{
  "schema_version": "1.0.0",
  "confirmation_id": "00000000-0000-4000-8000-000000000085",
  "command_id": "00000000-0000-4000-8000-000000000084",
  "plan_id": "00000000-0000-4000-8000-000000000072",
  "actor_ref": "owner:primary",
  "token_hash": "sha256:5555555555555555555555555555555555555555555555555555555555555555",
  "issued_at": "2026-09-25T12:24:05+03:00",
  "expires_at": "2026-09-25T12:34:05+03:00",
  "state": "pending",
  "one_time": true,
  "confirmed_at": null
}
